  [{
    "ocr": "MENLYN MAIN CENTRE\nSUPERSPAR\nVAT NR: 4770111336\nLIQ LIC: GLB700000378\nPHONE NR: 012 348 2204\nSAVOURY BREAD\n1 @ 24.99\nSIR JUICE APPLE/CRANBER 50OML\nTOTAL FOR 2 ITEMS\nTENDERED Credit Card\nVAT rate\n15.00%\nSLIP / TILL\n7129 007\nCASHIER NAME:\nTAX INVOICE\nexc1.\n45.20\nEACH\nTAX\n6.78\n/ CASHIER / DATE /\n203 15.05.24\nFikile\nTHANK YOU FOR\nYOUR SUPPORT\nPLEASE CALL AGAIN\nR\n24.99 A\n26.99 A\n51.98\n51.98\nincl.\n51.98 A\nTIME\n12:16",
    "place_name": "SUPERSPAR",
    "timestamp": "2024-05-15 12:16",
    "items": [
      {
        "name": "SAVOURY BREAD",
        "quantity": 1,
        "price": 24.99
      },
      {
        "name": "SIR JUICE APPLE/CRANBER 500ML",
        "quantity": 1,
        "price": 26.99
      }
    ],
    "total": 51.98,
    "currency": "R"
  },
  {
    "ocr": "R&B Menlyn\nShop 41, Central Sgaure\nTel: 012 348 0029\nCHECK\n2 T Bone\n1 Sprite\n1 Iced Tea Peach\nFRI MAY 10,2024\n#339442-2\n1 Dry Lemon\n1 LM Schnitzel\n1 LM Steak\nSUB-TOTAL\nTip:\nTABLE #6\nDUPLICATE\n10% Corporate\nTOTAL\nTotal:\nName:\nEmail:\nTime: 12:49\n238.00\nVAT: 4440274183\n29.00\n39.00\n29.00\nYOU HAVE BEEN SERVED\nBY: Kgothatso\n99.00\n99.00\n533.00\n479.70\n53.30-\nICSTO R",
    "place_name": "R&B Menlyn",
    "timestamp": "2024-05-10 12:49",
    "items": [
      {
        "name": "T Bone",
        "quantity": 2,
        "price": 238.00
      },
      {
        "name": "Sprite",
        "quantity": 1,
        "price": 29.00
      },
      {
        "name": "Iced Tea Peach",
        "quantity": 1,
        "price": 39.00
      },
      {
        "name": "Dry Lemon",
        "quantity": 1,
        "price": 29.00
      },
      {
        "name": "LM Schnitzel",
        "quantity": 1,
        "price": 99.00
      },
      {
        "name": "LM Steak",
        "quantity": 1,
        "price": 99.00
      }
    ],
    "total": 533.00,
    "currency": "R"
  },
  {
    "ocr": "MENLYN MAIN CENTRE\nSUPERSPAR\nSAVOURY BREAD\nVAT rate\n15.00%\nVAT NR: 4770111336\nLIQ LIC: GLB700000378\nPHONE NR: 012 348 2204\n1@ 24.99\nTOTAL FOR 1 ITEMS\nTENDERED Credit Card\n0322\nEACH\nTAX INVOICE\nexcl.\n21.73\nTAX\n3.26\nR\nTHANK YOU FOR\nYOUR SUPPORT\nPLEASE CALL AGAIN\n24.99 A\n24.99\n24.99\nSLIP / TILL / CASHIER / DATE\n004\n226 06.05.24 12:08\nCASHIER NAME: Rebecca\nincl.\n24.99 A\n/ TIME",
    "place_name": "SUPERSPAR",
    "timestamp": "2024-05-06 12:08",
    "items": [
      {
        "name": "SAVOURY BREAD",
        "quantity": 1,
        "price": 24.99
      }
    ],
    "total": 24.99,
    "currency": "R"
  },
  {
    "ocr": "KAUAI MENLYN MAINE\nMenlyn Ma ine Centraal Square, Corner of\nDallas Ave and, Ar amist Ave, Menlyn,\nPretoria\nPhone : 087 159 0127\nVAT:\nNATURALLY\n1335 SIKHALIPHILE\nCHK 1035\nSubtotal\nPayment\n2024/05/06 12:14 PM\n1 Berry Dairy Lrg\n+Whey Protein\nCard Ret\nTBL 101/1\nChange Due\n11.61 RSA VAT 15%\n11.61 Tax\nCheck Clo0sed\n69.00\n20.00\nR89.00\nR89.00\nR89.00\nRO.0O\n89.00\n89,00\n2024/05/06 12:14 PM",
    "place_name": "KAUAI MENLYN MAINE",
    "timestamp": "2024-05-06 12:14",
    "items": [
      {
        "name": "Berry Dairy Lrg + Whey Protein",
        "quantity": 1,
        "price": 89.00
      }
    ],
    "total": 89.00,
    "currency": "R"
  },
  {
    "ocr": "AQUELLE HATER STILL\nSPAR SPAGHETTI\nLIPTON I/TEA M/B\nTOTAL FOR 3 ITEMS\nTENDERED Credit Card\nVAT rate\n15.00%\nMENLYN MAIN CENTRE\nSUPERSPAR\nVAT NR: 4770111336\nLIQ LIC: GLB700000378\nPHONE NR: 012 348 2204\n9639\nexcl.\n65.19\n5LT\nTAX INVOICE\n002\nCASHIER NAME: Rebecca\n500GR\n226\n1.5LT\nSLIP_/ TILL / CASHIER / DATE /\nTAX\n9.78\n03.05.24\nTHANK YOU FOR\nYOUR SUPPORT\nPLEASE CALL AGAIN\nR\n29.99 A\n18.99 A\n25.99 A\n74.97\n74.97\nincl.\n74.97 A\nTIME\n16:12",
    "place_name": "SUPERSPAR",
    "timestamp": "2024-05-03 16:12",
    "items": [
      {
        "name": "AQUELLE HATER STILL 5LT",
        "quantity": 1,
        "price": 29.99
      },
      {
        "name": "SPAR SPAGHETTI 500GR",
        "quantity": 1,
        "price": 18.99
      },
      {
        "name": "LIPTON I/TEA M/B 1.5LT",
        "quantity": 1,
        "price": 25.99
      }
    ],
    "total": 74.97,
    "currency": "R"
  },
  {
    "ocr": "PicknPlay\nCASHIER: Thabarne Leknu\nMenl yn Maine\n087 750 2054 /2053\nPADS SOF T&DRY NGHTS\nCRMB CHKN SCHNITZEL pk\nFLCRA PLANT BUỊTER F/SPD 75%\nCARRIER BAG 24L\nKOC WHOLE KERNEL CORN 410g\nMCCAIN 0/CHIPS C/CUT CRISPY\ne\nVAT INCL\n# ZERO-RATED\nNON-SUPPLY\nDUE VAT INCL\n-TENDER\nMASTERCARD\n882413\nTOTAL I TEMS:\n--TAX INvOICE-\nTAXABLE VAL\n170.27\n19,99\n19.99#\n20.60\n62.99\n1.20\n22.99\nWEBSITE: www.pi cknpay. C0.2a\nTHANK YOU FOR SHOPPING WITH US\n52.49\n190.26\n190.26\nVAT VAL\n6\n22.21\n---VAT REG NO, 4090105588-\nV VITALITY HEALTHYFODD CASH BACK ITEM\n0.00\nLiquor Lic.:GLB//5001126\nPLEASE RETAIN AS YOUR GUARANIEE\nCUSTOMER CARE L INE: 0860 30 30 30",
    "place_name": "PicknPay",
    "timestamp": "2024-05-03 16:12",
    "items": [
      {
        "name": "PADS SOF T&DRY NGHTS",
        "quantity": 1,
        "price": 52.49
      },
      {
        "name": "CRMB CHKN SCHNITZEL pk",
        "quantity": 1,
        "price": 19.99
      },
      {
        "name": "FLORA PLANT BUTTER F/SPD 75%",
        "quantity": 1,
        "price": 22.99
      },
      {
        "name": "CARRIER BAG 24L",
        "quantity": 1,
        "price": 1.20
      },
      {
        "name": "KOO WHOLE KERNEL CORN 410g",
        "quantity": 1,
        "price": 20.60
      },
      {
        "name": "MCCAIN O/CHIPS C/CUT CRISPY",
        "quantity": 1,
        "price": 62.99
      }
    ],
    "total": 190.26,
    "currency": "R"
  },
  {
    "ocr": "SAVOURY\n1\nMENLYN MAIN CENTRE\nSUPERSPAR\nVAT NR: 4770111336\nLIQ LIC: GLB700000378\nPHONE NR: 012 348 2204\nVAT rate\n15.00%\nBREAD\n@ 24.99\nSIR THE BERRIES\nTOTAL\nTENDERED Credit Card\nFOR 2 ITEMS\nexcl.\nTAX INVOICE\n45.20\nEACH\nSLIP / TILL\n5594 001\nCASHIER NAME: Tsakane\n500ML\nTAX\n6.78\n/ CASHIER / DATE /\n150 09.05.24\nTHANK YOU FOR\nYOUR SUPPORT\nPLEASE CALL AGAIN\nR\n24.99 A\n26.99 A\n51.98\n51.98\nincl.\n51.98 A\nTIME\n12:22",
    "place_name": "SUPERSPAR",
    "timestamp": "2024-05-09 12:22",
    "items": [
      {
        "name": "SAVOURY BREAD",
        "quantity": 1,
        "price": 24.99
      },
      {
        "name": "SIR THE BERRIES",
        "quantity": 1,
        "price": 26.99
      }
    ],
    "total": 51.98,
    "currency": "R"
  },
  {
    "ocr": "MENLYN MAIN CENTRE\nSUPERSPAR\nVAT NR: 4770111336\nLIQ LIC: GLB700000378\nPHONE NR: 012 348 2204\nRED BULL APR/STR\nSAVOURY BREAD\n1 @ 24.99\nTOTAL FOR 2 ITEMS\nTENDERED Credit Card\nVAT rate\n15.00%\n--- TAX INVOICE\nexcl.\n37.37\n250ML\nEACH\nSLIP / TILL\n6294 005\nCASHIER NAME:\nTAX\n5.61\n/ CASHIER / DATE\n253 20.03.24\n/\nPATRICIA M\nTHANK YOU FOR\nYOUR SUPPORT\nPLEASE CALL AGAIN\nR\n17.99 A\n24.99 A\n42.98\n42.98\nincl.\n42.98 A\nTIME\n12:17",
    "place_name": "SUPERSPAR",
    "timestamp": "2024-03-20 12:17",
    "items": [
      {
        "name": "RED BULL APR/STR 250ML",
        "quantity": 1,
        "price": 17.99
      },
      {
        "name": "SAVOURY BREAD",
        "quantity": 1,
        "price": 24.99
      }
    ],
    "total": 42.98,
    "currency": "R"
  },
  {
    "ocr": "MENLYN MAIN CENTRE\nSUPERSPAR\nSAVOURY BREAD\nVAT rate\n15.00%\nVAT NR: 4770111336\nLIO LIC: GLB700000378\nPHONE NR: 012 348 2204\n1@ 24.99\nSIR THE BERRIES\nTOTAL FOR 2 ITEMS\nTENDERED Credit Card\n5594\nexcl.\n45.20\n-- TAX INVOICE\nEACH\n500ML\n001\nCASHIER NAME: Tsakane\nTAX\n6.78\nR\nSLIP / TILL / CASHIER / DATE/ TIME\n24.99 A\n26.99 A\n51.98\nTHANK YOU FOR\nYOUR SUPPORT\nPLEASE CALL AGAIN\n51.98\nincl.\n51.98 A\n09.05.24 12:22",
    "place_name": "SUPERSPAR",
    "timestamp": "2024-05-09 12:22",
    "items": [
      {
        "name": "SAVOURY BREAD",
        "quantity": 1,
        "price": 24.99
      },
      {
        "name": "SIR THE BERRIES",
        "quantity": 1,
        "price": 26.99
      }
    ],
    "total": 51.98,
    "currency": "R"
  },
  {
    "ocr": "MENLYN MAIN CENTRE\nSUPERSPAR\nVAT NR: 4770111336\nLIQ LIC: GLB700000378\nPHONE NR: 012 348 2204\nSPAR MILK SKIM\nBEEF FRIKKADELS\n0.396kg @ 129.99R\nDORITOS SWT CHIL\nL/HOOD GOUDA GR\nLIPTON ICE TEA\nAG TOMATO SAUCE\nTOTAL FOR 6 ITEMS\nTENDERED Credit Card\nVAT rate\n0.00%\n15.00%\nexc].\n19.49\n1LT\n158.64\n1P/K\n/kg\n240GR\n200GR\n1.5LT\nTAX INVOICE\n350ML\nTAX\n0.00\n23.80\nSLIP / TILL\n2031 003\nCASHIER NAME: Priscilla\nTHANK YOU FOR\nYOUR SUPPORT\nPLEASE CALL AGAIN\nR\n19.49 -\n51.48\n25.99\n46.99\n25.99\n31.99\n201.93\n201.93\nincl.\n19.49\n182.44 A\n/ CASHIER/ DATEN\n221 22.04.24 17:12",
    "place_name": "SUPERSPAR",
    "timestamp": "2024-04-22 17:12",
    "items": [
      {
        "name": "SPAR MILK SKIM 1LT",
        "quantity": 1,
        "price": 19.49
      },
      {
        "name": "BEEF FRIKKADELS 0.396kg",
        "quantity": 1,
        "price": 51.48
      },
      {
        "name": "DORITOS SWT CHIL 240GR",
        "quantity": 1,
        "price": 25.99
      },
      {
        "name": "L/HOOD GOUDA GR 200GR",
        "quantity": 1,
        "price": 46.99
      },
      {
        "name": "LIPTON ICE TEA 1.5LT",
        "quantity": 1,
        "price": 25.99
      },
      {
        "name": "AG TOMATO SAUCE 350ML",
        "quantity": 1,
        "price": 31.99
      }
    ],
    "total": 201.93,
    "currency": "R"
  },
  {
    "ocr": "B0S ICE TEA BERR\nSPAR SPAGHETTI\nSAVOURY\n1\nMENLYN MAIN CENTRE\nSUPERSPAR\nVAT NR: 4770111336\nLIQ LIC: GLB700000378\nPHONE NR: 012 348 2204\n@ 21.99\nTOTAL FOR 3 iEMS\nTENDERED Credit ard\nVAT rate\n15.00%\nBREAD\n@\n0\n7514\nCASHIER NAM. :\nTHS\n300ML\nPLEH..\n500GR\n- TAX INVOICE\nevcl.\n54.76\nEACH\nSLIP / TILL / CASHIER / DATE /\nTAX\n3.21\n208 25.03.24\nFOR\nRT\n-GAIN\nR\nR\n18.99 A\n18.99 A\n24.99 A\n2.97\n62.97\nincl.\n62.97 A\nTIME\n12:14",
    "place_name": "SUPERSPAR",
    "timestamp": "2024-03-25 12:14",
    "items": [
      {
        "name": "BOS ICE TEA BERR 300ML",
        "quantity": 1,
        "price": 18.99
      },
      {
        "name": "SPAR SPAGHETTI 500GR",
        "quantity": 1,
        "price": 18.99
      },
      {
        "name": "SAVOURY BREAD",
        "quantity": 1,
        "price": 24.99
      }
    ],
    "total": 62.97,
    "currency": "R"
  },
  {
    "ocr": "MENLYN MAIN CENTRE\nSUPERSPAR\nKIT KAT CHOC MILK 4F 41.5G\nTHIRSTI ISOFIT\nVAT rate\n15.00%\nVAT NR: 4770111336\nLIQ LIC: GLB700000378\nPHONE NR: 012 348 2204\nENDURA RACEDAY R/BERRY\nTOTAL FOR 3 ITEMS\nTENDERED Credit Card\n5042\nexc1.\n38.23\n500ML\nTAX INVOICE\nTAX\n007\nCASHIER NAME: Priscilla\n630ML\n5.74\nR\nTHANK YOU FOR\nYOUR SUPPORT\nPLEASE CALL AGAIN\n14.\n1i.)\n16.39\n43.97\nSLIP / TILL / CASHIER / DATE /\n221 19.03.24 08:20\n43.97\ninc].\n43.97\nTIME",
    "place_name": "SUPERSPAR",
    "timestamp": "2024-03-19 08:20",
    "items": [
      {
        "name": "KIT KAT CHOC MILK 4F 41.5G",
        "quantity": 1,
        "price": 14.00
      },
      {
        "name": "THIRSTI ISOFIT 500ML",
        "quantity": 1,
        "price": 16.39
      },
      {
        "name": "ENDURA RACEDAY R/BERRY 630ML",
        "quantity": 1,
        "price": 16.39
      }
    ],
    "total": 43.97,
    "currency": "R"
  },
  {
    "ocr": "MENL YN MAIN CENTRE\nCUPERSPAR\nVal NR: 4770111336\nLIQ LIC: GLB700000378\nPR AE NR: 012 348 2204\nBOS ICE TEA EHR\nSAVOURY BREAD\n1\nD4.J9\nTOTAL FOP 2 ITEMS\nTENDERED Ciedit Card\nVAT rate\n15 00%\n300ML\nEACH\n--- TAX INVOICE\nexc1.\n38.24\naAN\nTAX\n5.74\nR\nh le\nTH/ NK YOU FOR\nYOUR SUF ORT\nPLEASE CALL AGAIN\n18.99 A\n24.99 A\n43.98\n43.98\ninc1.\n43.98 A\n/ CASER/ DATE/ TIME\n203 22.03.24 12:25",
    "place_name": "SUPERSPAR",
    "timestamp": "2024-03-22 12:25",
    "items": [
      {
        "name": "BOS ICE TEA BERR 300ML",
        "quantity": 1,
        "price": 18.99
      },
      {
        "name": "SAVOURY BREAD",
        "quantity": 1,
        "price": 24.99
      }
    ],
    "total": 43.98,
    "currency": "R"
  },
  {
    "ocr": "LAYS SALT\nLIPTON ICE TEA\nFRESH CHICKEN FILLETS 7 /KG\n0.646kg @ 87.99R\nSPAR MILK L/L 2%\nSPAR SPAGHETTI\nTOTAL FOR 5 ITEMS\nTENDERED Credit Card\nVAT rate\n0.00%\nMENLYN MAIN CENTRE\nSUPERSPAR\nVAT NR: 4770111336\nLIQ LIC: GLB700000378\nPHONE NR: 012 348 2204\n15.00%\n120GR\n1.5LT\nexcl.\n19.49\n108.97\nkg\n1LT\n500GR\nTAX INV0ICE\nTAX\n0.00\n16.34\nR\nTHANK YOU FOR\nYOUR SUPPORT\nPLEASE CALL AGAIN\n23.49 A\n25.99 A\n56.84 A\n19.49 *\n18.99 A\n144.80\n144.80\nincl.\n19.49 *\n125.31 A\nSLIP / TILL / CASHIER / DATE/ TIME\n4648\n005\n233 15.04.24 17:12\nCASHIER NAME: Bafidele",
    "place_name": "SUPERSPAR",
    "timestamp": "2024-04-15 17:12",
    "items": [
      {
        "name": "LAYS SALT 120GR",
        "quantity": 1,
        "price": 23.49
      },
      {
        "name": "LIPTON ICE TEA 1.5LT",
        "quantity": 1,
        "price": 25.99
      },
      {
        "name": "FRESH CHICKEN FILLETS 0.646kg",
        "quantity": 1,
        "price": 56.84
      },
      {
        "name": "SPAR MILK L/L 2% 1LT",
        "quantity": 1,
        "price": 19.49
      },
      {
        "name": "SPAR SPAGHETTI 500GR",
        "quantity": 1,
        "price": 18.99
      }
    ],
    "total": 144.80,
    "currency": "R"
  },
  {
    "ocr": "GAU/201670C\nLynnwood, Glenfair Mal1\nTel No 012 470-9980\nTAX Invo i ce VAT NO. 4420106777\nCheckers\nBRDBRW PRM 700G\nCHICKEN MINCE\nTOTAL\nRate\n15.00%\nElect Payment\n* 0.00%\nVat\n6.08\n0.00\nR16.99\nR46.61\nR63.60\nTOTAL\n2. Visit checkers.co.za\nR63.60\n46.61\n16.99\nGet your XIRA SAVINGS Card now\nto get xtra cash savings, Instantly !\nTo sign up in just 3min, either:\n1. Dial *134*885*CARDNUMBER#\nYou were helped by\nNompume lelo Nkambule\n3. Add 087 240 5385 as a Whatsâpp\ncontact and say \"Hi\"\nCO097 #0298 18:36:55 270324 S001771 RO8\nPlease keep your till slip\nas proof of purchase\nFor cash rounding. VAT shown on this\nslip must be ad jus ted for inPut tax",
    "place_name": "Checkers",
    "timestamp": "2024-03-27 18:36",
    "items": [
      {
        "name": "BRDBRW PRM 700G",
        "quantity": 1,
        "price": 16.99
      },
      {
        "name": "CHICKEN MINCE",
        "quantity": 1,
        "price": 46.61
      }
    ],
    "total": 63.60,
    "currency": "R"
  },
  {
    "ocr": "tops!\nGLENFAIR TOPS\nVAT : 42 10229326\nTEL : 0607923436\nChr Lynwood & Daventry 0ad\nLÀ REG NO : GAU037899\nPORCUPINE CHARD\nTOTAL FOR 1 ITEMS\nTENDERED Credit Card\nVAT rate\n15.00%\n750ML\nTAX INVOICE\nTAX\n8.70\nexcl.\n57.99\nSLIP / TILL / CASHIER / DATE\n2649 C01\n21\nCASHIER NAME: POS 21\nR\n66.69 A\n66.69\n66.69\nincl.\n66.69 A\nTHANK YOU FOR SHOPPING WITH US\n/\n27.03.24 18:17\nTIME",
    "place_name": "GLENFAIR TOPS",
    "timestamp": "2024-03-27 18:17",
    "items": [
      {
        "name": "PORCUPINE CHARD 750ML",
        "quantity": 1,
        "price": 57.99
      }
    ],
    "total": 66.69,
    "currency": "R"
  },
  {
    "ocr": "KAUAT 1ENLYN MAINE\nMenlyn Maine Cent ral Square, Corner\nDallas Ave and, Aramist Ave, Menlyn,\nPretoria\nPhone : 087 159 0127\nVAT:\n1335 SIKHALIPHILE\nCHK 1839\nNATURALLY\n2024/04/17 12:15 PM\n1 BBQ Chicken Wrap\nCard Ret\nSubtotal\nPayment\n1 Peanut Butter Bomb Lrg 86.00\nTBL 117/1\nChange\nDue\n22.57 RSA VAT 15%\n22.57 Tax\n87.00\nR173.00\nR173.00\nCheck Closed--\n2024/04/17 12:15 PM",
    "place_name": "KAUAI MENLYN MAINE",
    "timestamp": "2024-04-17 12:15",
    "items": [
      {
        "name": "BBQ Chicken Wrap",
        "quantity": 1,
        "price": 87.00
      },
      {
        "name": "Peanut Butter Bomb Lrg",
        "quantity": 1,
        "price": 86.00
      }
    ],
    "total": 173.00,
    "currency": "R"
  },
  {
    "ocr": "TOTAL\nSAVOURY BREAD\n@ 24.99\nFOR 1 ITEMS\nTENDERED Credit Card\n1\nVAT rate\n15.00%\nEURRAR\n7029\nMENLYN MAIN CENTRE\nSUPERSPAR\nVAT NR: 4770111336\nLIQ LIC: GLB700000378\nPHONE NR: 012 348 2204\nTAX INVOICE\nTAX\nexcl.\n21.73\nEACH\nSLIP / TILL / CASHIER / DATE /\n005\nCASHIER NAME: Bonnie\n213\n3.26\n23.04.24\nTHANK YOU FOR\nYOUR SUPPORT\nPLEASE CALL AGAIN\nR\n24.99 A\n24.99\n24.99\nincl.\n24.99 A\nTIME\n12 :50",
    "place_name": "SUPERSPAR",
    "timestamp": "2024-04-23 12:50",
    "items": [
      {
        "name": "SAVOURY BREAD",
        "quantity": 1,
        "price": 24.99
      }
    ],
    "total": 24.99,
    "currency": "R"
  },
  {
    "ocr": "N/GARDEN S/FRY F\nMEXICORN NACHOS LIGHTLY 250G\nLIPTON ICE TEA\nTOTAL FOR 3 ITEMS\nTENDERED Credit Card\nVAT rate\n0.00%\n15.00%\nMENLYN MAIN CENTRE\nSUPERSPAR\nVAT NR: 4770111336\nLIQ LIC: GLB700000378\nPHONE NR: 012 348 2204\n8930\n700GR\nexcl.\n45.99\n57.37\n15LT\nTAX INVOICE ----\nTAX\n0.00\n8.61\nSLIP / TILL / CASHIER / DATE/\n007\nCASHIER NAME: 0detta\n209 25.04.24\nTHANK YOU FOR\nYOUR SUPPORT\nPLEASE CALL AGAIN\n45.99 *\n39.99 A\n25.99 A\n111.97\n111.97\nincl.\n45.99 *\n65.98 A\nTIME\n17:09",
    "place_name": "SUPERSPAR",
    "timestamp": "2024-04-25 17:09",
    "items": [
      {
        "name": "N/GARDEN S/FRY F 700GR",
        "quantity": 1,
        "price": 45.99
      },
      {
        "name": "MEXICORN NACHOS LIGHTLY 250G",
        "quantity": 1,
        "price": 39.99
      },
      {
        "name": "LIPTON ICE TEA 1.5LT",
        "quantity": 1,
        "price": 25.99
      }
    ],
    "total": 111.97,
    "currency": "R"
  },
  {
    "ocr": "KAUAI MENLYN MATNE\nMenlyn Maine Cent ral Square, Corner of\nDallas Ave and, Aramist Ave, Menlyn.\nPretoria\nPhone : 087 159 0127\n4575 Bonginhlanhl\nVAT:\nNATURALLY\nCHK 1911 TBL 103/ 1\n2024/04/23 12:53 PM\nSubtotal\nPayment\n1 Golden Milk Lrg\nCard Ret\n11.22 Tax\nChange DUe\n11.22 RSA VAT 15%\n86.00\nR86.00\nR86.00\nR86.00\nRO.0O0\n86.00\n86.00\nCheck Closed\n2024/04/23 12:53 PM",
    "place_name": "KAUAI MENLYN MAINE",
    "timestamp": "2024-04-23 12:53",
    "items": [
      {
        "name": "Golden Milk Lrg",
        "quantity": 1,
        "price": 86.00
      }
    ],
    "total": 86.00,
    "currency": "R"
  },
  {
    "ocr": "MENLYN MA IN CENTRE\nSUPERSPAR\nVAT NR: 4770111336\nLIQ LIC: GLB700000378\nPHONE NR: 012 348 2204\nOREO BISC VANILL\nSHITCH S/80K EDT\nLIPTON ICE TEA\nSAVOURY BREAD\n1 @ 24.99\nfOTAL FOR 4 ITE4S\nTENDERED Credit Card\nVAT rate\n15.00%\nexcl.\n58.23\n32.9G\nTAX INVOICE\n5004L\n5004L\nSLIP / TILL\n8258 005\nCASHIER NAME: Kearabilwe\nEACH\nTAX\n8.73\n/ CASHIER / DATE /\n202 27.03.24\nTHANK YOU FOR\nYOUR SUPPORT\nPLEASE CALL AGAIN\nR\n11.99 A\n11.99 A\n17.99 A\n24.99 A\n66.96\n66.96\nincl,\n66.96 A\nTIME\n12:14",
    "place_name": "SUPERSPAR",
    "timestamp": "2024-03-27 12:14",
    "items": [
      {
        "name": "OREO BISC VANILL 32.9G",
        "quantity": 1,
        "price": 11.99
      },
      {
        "name": "SHITCH S/80K EDT",
        "quantity": 1,
        "price": 11.99
      },
      {
        "name": "LIPTON ICE TEA 5004L",
        "quantity": 1,
        "price": 17.99
      },
      {
        "name": "SAVOURY BREAD",
        "quantity": 1,
        "price": 24.99
      }
    ],
    "total": 66.96,
    "currency": "R"
  },
  {
    "ocr": "TOTAL\nSPAR GRNOLA T/CH\nSWITCH ENERGY CRAN CHER 500ML\nSPAR SPAGHETTI\nSPAR MILK L/L 2%\n(K)SPAR CARRIERS BAG RE 1S\nFOR 5 ITEMS\nVAT rate\n0.00%\nMENLYN MAIN CENTRE\nSUPERSPAR\nTENDERED Credit Card\n15.00%\nVAT NR: 4770111336\nLIQ LIC: GLB700000378\nPHONE NR: 012 348 2204\n9267\nexcl.\n19.49\nTAX INVOICE\n92.58\n1KG\n500GR\nCASHIER NAME: Ntombi\n1LT\nTAX\nSLIP / TILL / CASHIER / DATE/\n007 .212 26.04.24\n0.00\n13.89\nTHANK YOU FOR\nYOUR SUPPORT\nPLEASE CALL AGAIN\nR\n73.99 A\n11.99 A\n18.99 A\n19.49 *\n1.50 A\n125.96\n125.96\nincl.\n19.49 *\n106.47 A\nTIME\n16:16",
    "place_name": "SUPERSPAR",
    "timestamp": "2024-04-26 16:16",
    "items": [
      {
        "name": "SPAR GRNOLA T/CH 1KG",
        "quantity": 1,
        "price": 73.99
      },
      {
        "name": "SWITCH ENERGY CRAN CHER 500ML",
        "quantity": 1,
        "price": 11.99
      },
      {
        "name": "SPAR SPAGHETTI 500GR",
        "quantity": 1,
        "price": 18.99
      },
      {
        "name": "SPAR MILK L/L 2% 1LT",
        "quantity": 1,
        "price": 19.49
      },
      {
        "name": "SPAR CARRIERS BAG RE 1'S",
        "quantity": 1,
        "price": 1.50
      }
    ],
    "total": 125.96,
    "currency": "R"
  },
  {
    "ocr": "PicknPlay\nCASHIER: Cashier 05 NC67\n# ZERO-RATED\nVAT INCL\nPNE FRZ BABY PEAS 500g\nDUE VAT INCL\nTENDER\ne\nMenl yn Maine\n087 750 2054 /2053\nNON-SUPPLY\nMASTERCARD\n87145\nTOTAL ITEMS:\n--TAX INVOICE-\nTAXABLE VAL\n47.99\n0.00\nLiquor L1c.:GLB//5001126\n47.99#V\n47.99\n*1089/ ol 3867005\n47.99\nBSITE: www.picknpay, co.Za\nTHANK YOU FCR S HOPPING WITH US\nVAT VAL\n---VAT REG NO. 4090105588-\nV VITALITY HEAL T-VF0DD CASH BACK IIEM\n1\n0.00\nPLEASE RETAIN AS YOUR GUARANTEE\nCUSTOMER CARE LINE. 0860 30 30 30\n0.00\n27.04.24 l6:11",
    "place_name": "PicknPay",
    "timestamp": "2024-04-27 16:11",
    "items": [
      {
        "name": "PNE FRZ BABY PEAS 500g",
        "quantity": 1,
        "price": 47.99
      }
    ],
    "total": 47.99,
    "currency": "R"
  },
  {
    "ocr": "1\nEUAURRAR\nMENLYN MAIN CENTRE\nSUPERSPAR\nM/MAINE ASSORTED PIZZA EACH\n@ 32.99\nFOR 1 ITEMS\nVAT rate\n15.00%\nVAT NR: 4770111336\nLIQ LIC: GLB700000378\nPHONE NR: 012 348 2204\nTOTAL\nTENDERED Credit Card\nTAX INVOICE\nTAX\nexcl.\n28.69\n4.30\nSLIP_/ TILL / CASHIER / DATE\n7423 005\nCASHIER NAME: Bonnie\n/\n213 24.04.24\nTHANK YOU FOR\nYOUR SUPPORT\nPLEASE CALL AGAIN\nR\n32.99 A\n32.99\n32.99\ninc1.\n32.99 A\nTIME\n12:18",
    "place_name": "SUPERSPAR",
    "timestamp": "2024-04-24 12:18",
    "items": [
      {
        "name": "M/MAINE ASSORTED PIZZA EACH",
        "quantity": 1,
        "price": 32.99
      }
    ],
    "total": 32.99,
    "currency": "R"
  },
  {
    "ocr": "VAT rate\n15.00%\nMENLYN MAIN CENTRE\nSUPERSPAR\nDIVELLA FARFALLE #85 500G\nPOLLI SUNDRIED TOMATOES 285G\nTOTAL FOR 2 ITEMS\nTENDERED Credit Card\nVAT NR: 4770111336\nLIQ LIC: GLB700000378\nPHONE NR: 012 348 2204\n4227\n-- TAX INVOICE\nexc1.\n119.98 18.00\nTAX\nSLIP_/ TILL / CASHIER / DATE\n005\nCASHIER NAME: TSHIAMO\n231\nR\n42.99 A\nTHANK YOU FOR\nYOUR SUPPORT\nPLEASE CALL AGAIN\n94.99 A\n137.98\n137.98\nincl.\n137.98 A\n/ TIME\n14.04.24 13:37",
    "place_name": "SUPERSPAR",
    "timestamp": "2024-04-14 13:37",
    "items": [
      {
        "name": "DIVELLA FARFALLE #85 500G",
        "quantity": 1,
        "price": 42.99
      },
      {
        "name": "POLLI SUNDRIED TOMATOES 285G",
        "quantity": 1,
        "price": 94.99
      }
    ],
    "total": 137.98,
    "currency": "R"
  },
  {
    "ocr": "VAT rate\n15.00%\nSUTHRSRATIO\nMENLYN MAIN CENTRE\nSUPERSPAR\nVAT NR: 4770111336\nLIQ LIC: GLB700000378\nPHONE NR: 012 348 2204\nMAGNUM ALMOND\nTOTAL FOR 1 ITEMS\nTENDERED Credit Card\nSLIP / TILL\n5752 006\nCASHIER NAME:\nexc|.\n27.83\n100ML\nTAX INVOICE\nTAX\n4.17\nR\nThandiwe\nTHANK YOU FOR\nYOUR SUPPORT\nPLEASE CALL AGAIN\n32.00 A\n32.00\n32.00\nincl.\n32.00 A\n/ CASHIER / DATE/ TIME\n208 16.03.24 17:36",
    "place_name": "SUPERSPAR",
    "timestamp": "2024-03-16 17:36",
    "items": [
      {
        "name": "MAGNUM ALMOND 100ML",
        "quantity": 1,
        "price": 32.00
      }
    ],
    "total": 32.00,
    "currency": "R"
  },
  {
    "ocr": "lick n ay\nMerıl yn Maine\n087 750 2054 /2053\nCASHIER: Lucia Boishelo\nBERRY BUSH R0SE 750ml\nCARRIER BAG 24\nVAT INCL\n# ZERO-RATEJ\ne NON-SUPF_Y\nK351r\nDUE VAT INCL\n--- TENDER--\nMASTERCAR)\n357013\nTOTAL ITEYS:\n-- TAX 1NVOICE---.\nTAXAB_E VAL\n66.15\n0.00\n65.00\nLiguo -ic.:GLB//5001126\n1.15\n66.15\n66.15\n1\nVAT VAL\n---VAT REG NO. 4090105588-\nV VITALITY 4EALTHYF00D CASH BACK ITEM\nWEBSITE: NWw.piccrpay. co.Za\nTHANK YOU FOR SHOPPING WITH US\n2\n8.63\n0.00\nFLEASE RETAIN AS YOUR GUARANTEE\nCUSTOYER CARE LINE: 0860 30 30 30\n67 1023323 11 15.03. 24 16:25",
    "place_name": "PicknPay",
    "timestamp": "2024-03-15 16:25",
    "items": [
      {
        "name": "BERRY BUSH ROSE 750ml",
        "quantity": 1,
        "price": 65.00
      },
      {
        "name": "CARRIER BAG 24",
        "quantity": 1,
        "price": 1.15
      }
    ],
    "total": 66.15,
    "currency": "R"
  },
  {
    "ocr": "ERANO ROASTED SALT BLA 200GR\nSIMBA SMOKED BF\nDIVELLA FUSILLI #40\nA/G TOM PUREE\nSAVOURY BREAD\n1@\nPRV FRZN PORK PLAIN RAS /KG\n0.546kg @ 114.99 R\nLIPTON ICE TEA\nSPAR MIN WATER\nTOTAL FOR 8 ITEMS\nTENDERED Credit Card\nVAT rate\n15.00%\nMENLYN MAIN CENTRE\nSUPERSPAR\nVAT NR: 4770111336\nLIQ LIC: GLB700000378\nPHONE NR: 012 348 2204\n24.99\n2490\nexcl.\n234.53\n002\nCAS ER NAME: 0detta\n120GR\n500G\n410G\n209\nEACH\nTAX INVOICE\n/kg\n1.5LT\n5LT\nSLIP / TILL / CASHIER / DATE\nTAX\n35.18\n/\n13.03.24\nTHANK YOU FOR\nYOUR SUPPORT\nPLEASF CALL AGAIN\nR\n45.99 A\n17.99 A\n29.99 A\n32.99 A\n24.99 A\n62.78 A\n25.99 A\n28.99 A\n269.71\n269.71\nincl.\n269.71 A\nTIME\n12:27",
    "place_name": "SUPERSPAR",
    "timestamp": "2024-03-13 12:27",
    "items": [
      {
        "name": "ERANO ROASTED SALT BLA 200GR",
        "quantity": 1,
        "price": 45.99
      },
      {
        "name": "SIMBA SMOKED BF 120GR",
        "quantity": 1,
        "price": 17.99
      },
      {
        "name": "DIVELLA FUSILLI #40 500G",
        "quantity": 1,
        "price": 29.99
      },
      {
        "name": "A/G TOM PUREE 410G",
        "quantity": 1,
        "price": 32.99
      },
      {
        "name": "SAVOURY BREAD",
        "quantity": 1,
        "price": 24.99
      },
      {
        "name": "PRV FRZN PORK PLAIN RAS 0.546kg",
        "quantity": 1,
        "price": 62.78
      },
      {
        "name": "LIPTON ICE TEA 1.5LT",
        "quantity": 1,
        "price": 25.99
      },
      {
        "name": "SPAR MIN WATER 5LT",
        "quantity": 1,
        "price": 28.99
      }
    ],
    "total": 269.71,
    "currency": "R"
  },
  {
    "ocr": "MENLYN MAIN CENTRE\nSUPERSPAR\nVAT NR: 4770111336\nLIQ LIC: GLB700000378\nPHONE NR: 012 348 2204\nS/LIGHT LAUN BAR\nTOTAL FOR 1 ITEMS\nTENDERED Credit Card\nVAT rate\n15.00%\n2506\n-- TAX INVOICE --\nexcl. TAX\n12.17 1.82\nSLIP / TILL\n1846 001\nCASHIER NAME:\nR\nPetunia\nTHANK YOU FOR\nYOUR SUPPORT\nPLEASE CALL AGAIN\n13.99 A\n13 99\n13.99\nincl.\n13.99 A\n/ CASHIER / DATE/ TIME\n151 15.03.24 16:17",
    "place_name": "SUPERSPAR",
    "timestamp": "2024-03-15 16:17",
    "items": [
      {
        "name": "S/LIGHT LAUN BAR",
        "quantity": 1,
        "price": 13.99
      }
    ],
    "total": 13.99,
    "currency": "R"
  },
  {
    "ocr": "MENLYN MAIN CENTRE\nSÜPERSPAR\nVAT NR: 4770111336\nLIQ LIC: 700000378\nPHONE NP 2348 2204\nSAVOURY BREAD\n1@ 24.99\nLIPTON ICE TEA PEA\nTOTAL FOR 2 ITEMS\nTENDERED Credit Card\nVAT rate\n15.00%\n37.37\n-- TAX INVOICE\nexcl.\nEACH\nSLIP/ TILL\n4287 005\nCASHIER NAME: Kearabi lwe\n500ML\n202\nTAX\n5.61\n14.03.24\nR\nTHANK YOU FOR\nYOUR SUPPORT\nPLEASE CALL AGAIN\n24.99 A\n17.99 A\n42.98\n/ CASHIER / DATE/ TIME\n42.98\nincl.\n42.98 A\n12: 15",
    "place_name": "SUPERSPAR",
    "timestamp": "2024-03-14 12:15",
    "items": [
      {
        "name": "SAVOURY BREAD",
        "quantity": 1,
        "price": 24.99
      },
      {
        "name": "LIPTON ICE TEA PEA 500ML",
        "quantity": 1,
        "price": 17.99
      }
    ],
    "total": 42.98,
    "currency": "R"
  },
  {
    "ocr": "PicknPay\nMenl yn Maine\n087 750 2054 /2053\nIER: pruuenoe khumalo\nPNP FRZ BABY PEAS 500g\nLAY'S CHIPS SAL TED 120g\nLANCEWOOD GRATED GOUDA 200g\nDURACELL MAINLINE PLUS AAA 2\n5000394147195\ne\nFLORA PLANT BUTTER F/SPD 75%\nPADS SOFT&DRY NGHTS\nFLOUR SELF RAISING\nEAR BUDS 100EA\nVAT INCL\n# ZERO-RATED\nNON-SUPPLY\nDUE VAT INCL\n--TENDER---\nMASTERCARD\n856580\nTOTAL ITEMS:\n--TAX INVOICE----\nTAXABLE VAL\n231.94\n66.98\n45.99#V\nLiquor Lic, :GLB//5001126\n23.99\n44.99\n64.99\n62.99\n20.99#\n16.99\n17.99\n298.92\n298.92\nVAT VAL\n30.25\n---- VAT REG NO, 4090105588\nV VITALITY HEAL THYFOOD CASH BACK ITEM\n0.00\nPLEASE RETAIN AS YOUR GUARANTEE\nCUSTOMER CARE LINE: 0860 30 30 30",
    "place_name": "PicknPay",
    "timestamp": "2024-03-14 12:16",
    "items": [
      {
        "name": "PNP FRZ BABY PEAS 500g",
        "quantity": 1,
        "price": 45.99
      },
      {
        "name": "LAY'S CHIPS SALTED 120g",
        "quantity": 1,
        "price": 23.99
      },
      {
        "name": "LANCEWOOD GRATED GOUDA 200g",
        "quantity": 1,
        "price": 44.99
      },
      {
        "name": "DURACELL MAINLINE PLUS AAA 2",
        "quantity": 1,
        "price": 64.99
      },
      {
        "name": "FLORA PLANT BUTTER F/SPD 75%",
        "quantity": 1,
        "price": 62.99
      },
      {
        "name": "PADS SOFT&DRY NGHTS",
        "quantity": 1,
        "price": 20.99
      },
      {
        "name": "FLOUR SELF RAISING",
        "quantity": 1,
        "price": 16.99
      },
      {
        "name": "EAR BUDS 100EA",
        "quantity": 1,
        "price": 17.99
      }
    ],
    "total": 298.92,
    "currency": "R"
  },
  {
    "ocr": "KAUAI MENLYN MAINE\nMenlyn Ma ine Central Square, Corner of\nlal las Ave and, Aramist Ave, Menlyn,\nPretoria\nPhone: 087 159 0127\n4575 Bong inb lanhl\nSubtotal\nPayment\nVAT:\nNATURALLY\nCHK 1 131\n2024/04/24\n1 Berry Dairy Lrg\nCard Ret\nTBL 107/1\n12:19 PM\nChange DLUe\n9.00 KSA VAT 15%\n9.00 Tax\n69.00\nR69.00\nR69.00\nR69.00\nRO.O0\n69.00\n69.00\nCheck Closed\n2024/04/24 12:19 PM",
    "place_name": "KAUAI MENLYN MAINE",
    "timestamp": "2024-04-24 12:19",
    "items": [
      {
        "name": "Berry Dairy Lrg",
        "quantity": 1,
        "price": 69.00
      }
    ],
    "total": 69.00,
    "currency": "R"
  },
  {
    "ocr": "KAUAI MENLYN MAINE\nMenlyn Ma ine Central Square, Corner of\nDallas Ave and, Aramist Ave, Menlyn,\nPretoria\nPhone : 087 159 0127\n1335 SIKHALIPHILE\nVAT:\nNATURALLY\nCHK 1053 TBL 125/1\n2024/04/18 12:13 PM\n1 Roasted Veg Falafel Wrap 95.00\n1 Berry Dairy Lrg\nCard ket\nSubtotal\nPayment\nChange DLUe\n21.39 RSA VAT 15%\n21.39 Tax\n69.00\nR164.00\nRi64.00\nR164.00\nRO.00\n164.00\n164.00\nCheck Cl osed\n2024/04/ 18 12:13 PM",
    "place_name": "KAUAI MENLYN MAINE",
    "timestamp": "2024-04-18 12:13",
    "items": [
      {
        "name": "Roasted Veg Falafel Wrap",
        "quantity": 1,
        "price": 95.00
      },
      {
        "name": "Berry Dairy Lrg",
        "quantity": 1,
        "price": 69.00
      }
    ],
    "total": 164.00,
    "currency": "R"
  },
  {
    "ocr": "Menlyn Ma ine Central Square, Corner of\nDallas Ave and, Aramist Ave, Menlyn,\nPretoria\nKAUAI MENLYN MAINE\nPhone: 087 159 0127\n7858 Vhuhwavho\nCard Ret\nVAT:\nCHK 1810 TBL 119/1\n2024/04/22 5:16 PM\nSubtotal\nPaynent\nNATURALLY\n1 Peanut Butter Bliss Lrg 69.00\nChange DUe\n9.00 RSA VAT 15%\n9.00 Tax\nR69.00\nR69.00\nR69.00\n-- Check Closed\n2024/04/22 5:17 PM\nRO.00\n69.00\n69.00",
    "place_name": "KAUAI MENLYN MAINE",
    "timestamp": "2024-04-22 17:16",
    "items": [
      {
        "name": "Peanut Butter Bliss Lrg",
        "quantity": 1,
        "price": 69.00
      }
    ],
    "total": 69.00,
    "currency": "R"
  },
  {
    "ocr": "MENLYN MAIN CENTRE\nSUPERSPAF\nVAT NR: 4770111336\nLIQ LIC: GLB700000378\nPHONE NR: 012 348 2204\nSPAR MIN WATER\nVAT rate\n15.00%\nTOTAL\nTENDERED Credit Card\nFOR 1 ITEMS\nTAX INVOICE\nexcl.\n25.21\n5LT\nSLIP/ TILL\n3024 003\nCASHIER NAME: TSHIAMO\nTAX\n3.78\nR\nTHANK YOU FOR\nYOUR SUPPORT\nPLEASE CALL AGAIN\n28.99 A\n28.99\n28.99\n/ CASHIER/ DATE / TIME\n231 27.04.24 16:18\nincl.\n28.99 A",
    "place_name": "SUPERSPAR",
    "timestamp": "2024-04-27 16:18",
    "items": [
      {
        "name": "SPAR MIN WATER 5LT",
        "quantity": 1,
        "price": 28.99
      }
    ],
    "total": 28.99,
    "currency": "R"
  },
  {
    "ocr": "TOTAL\nMENLYN MAIN CENTRE\nSUPERSPAR\nCREO BISC\nSAVOURY BREAD\n1\nVAT rate\n15.00%\nVAT NR: 4770111336\nLIQ LIC: GLB700000378\nPHONE NR: 012 348 2204\n128.8G\n3463\nTENDERED Credit Card\n@ 24.99\nFOR 2 ITEMS\n128.8\nEACH\nTAX INVOICE\nTAX\nexcl.\n37.37\n5.61\nR R\n17.99 A\nTHANK YOU FOR\nYOUR SUPPORT\nPLEASE CALL AGAIN\n24.99 A\n42.98\n42.98\nSLIP / TILL / CASHIER / DATE/\n006 203 30.04.24 12:17\nCASHIER NAME: Fikile\nincl\n42.98 A\nTIME",
    "place_name": "SUPERSPAR",
    "timestamp": "2024-04-30 12:17",
    "items": [
      {
        "name": "CREO BISC 128.8G",
        "quantity": 1,
        "price": 17.99
      },
      {
        "name": "SAVOURY BREAD",
        "quantity": 1,
        "price": 24.99
      }
    ],
    "total": 42.98,
    "currency": "R"
  },
  {
    "ocr": "KAUAI MENLYN MAINE\nMeniyn Maine Cent ral Square, Corner of\nDallas Ave and, Aram ist Ave, Menlyn,\nPretorla\nPhone : 087 159 0127\nVAT:\n7658 ydavat\nNATLY\nTBL\n024/04/30 12:20 PM\nHK 1099\n1 Berry Da iry Lrg\nCard Ret\nSubtota l\nPayment\nChange Due\n9.00 RSA VAT 15%\n9.00 Tax\n69.00\nR69,00\nR69.00\nR69.00\nCheck Closed\n2024/04/30 12:20 PH\nRO.00\n69.00\n9/1\n69.00",
    "place_name": "KAUAI MENLYN MAINE",
    "timestamp": "2024-04-30 12:20",
    "items": [
      {
        "name": "Berry Dairy Lrg",
        "quantity": 1,
        "price": 69.00
      }
    ],
    "total": 69.00,
    "currency": "R"
  },
  {
    "ocr": "MENLYN MAIN CENTRE\nSUPERSPAR\nVAT NR: 4770111336\nLIQ LIC: GLB700000378\nPHONE NR: 012 348 2204\nDORITOS SWT CHIL\nAQUELLE WATER STILL\nTOTAL FOR 2 ITEMS\nTENDERED Credit Card\nVAT rate\n15.00%\nSLIP/ TILL\n5587 005\nCASHIER NAME:\nTAX INVOICE\nexcl.\n48.68\n240GR\n5LT\nTAX\n7.30\n/ CASHIER / DATE/\n208 18.04.24\nThandi\nTHANK YOU FOR\nYOUR SUPPORT\nPLEASE CALL AGAIN\nR\n25.99\n29.99 #\n55.98\n55.98\nincl.\n55.98 A\nTIME\n17:12",
    "place_name": "SUPERSPAR",
    "timestamp": "2024-04-18 17:12",
    "items": [
      {
        "name": "DORITOS SWT CHIL 240GR",
        "quantity": 1,
        "price": 25.99
      },
      {
        "name": "AQUELLE WATER STILL 5LT",
        "quantity": 1,
        "price": 29.99
      }
    ],
    "total": 55.98,
    "currency": "R"
  },
  {
    "ocr": "BONAQUA STILL\nSPAR MILK L/L 2%\nLIPTON I/TEA M/B\nLAYS SALT\nMENLYN HAIN CENTRE\nSUPIRSPAR\nVAT NR: 4770111336\nLIQ LIC: GLB700000378\nPHONE NR: 012 348 2204\nTOTAL\n(K) SPAR CARRIERS BAG RE 1'S\nFOR 5 ITEMS\nTENDERED Credit Card\nVAT rate\n0.00%\n15.00%\nexcl.\n5LT\nTAX INVOICE\n19.49\n1.5LT\n120GR\n67.80\nTAX\n0.00\n10.17\nR\n25 99 A\n19.49 *\nTHANK YOU FOR\nYOUR SUPPORT\nPLEASE CALL AGAIN\n25.99 A\n23.49 A\n1.50 A\n97.46\n97.46\nincl.\n19.49 *\n77.97 A\nToday SPAR Saved You\n0.50\nSLIP / TILL / CASHIER / DATE / TIME\n6927 004 152 22.03.24 16:12\nCASHIER NAME: Florence",
    "place_name": "SUPERSPAR",
    "timestamp": "2024-03-22 16:12",
    "items": [
      {
        "name": "BONAQUA STILL 5LT",
        "quantity": 1,
        "price": 19.49
      },
      {
        "name": "SPAR MILK L/L 2% 1.5LT",
        "quantity": 1,
        "price": 25.99
      },
      {
        "name": "LIPTON I/TEA M/B 1.5LT",
        "quantity": 1,
        "price": 25.99
      },
      {
        "name": "LAYS SALT 120GR",
        "quantity": 1,
        "price": 23.49
      },
      {
        "name": "SPAR CARRIERS BAG RE 1'S",
        "quantity": 1,
        "price": 1.50
      }
    ],
    "total": 97.46,
    "currency": "R"
  },
  {
    "ocr": "MENLYN MÀIN CENTRE\nSUPERSPAR\nVAT NR: 4770111336\nLIQ LIC: GLB700000378\nPHONE NR: 012 348 2204\nLAYS AMERICAN BB\nLIPTON ICE TEA\nM/MAINE ASSORTED PIZZA\n1 @\nTUC BISC 100G 0\nSPAR GRN A T/CH\nMERBA COKIES CHOCOLATE 200GR\nVAT rate\n15.00%\n32.99\nSPAR MIN WATER\nTOTAL FOR 7 ITEMS\nTENDERED Credit Card\n67.76\n0.00%\n15.00%\n28.99\n5LT\nTAX INVOICE\nexcl.\nSLIP / TILL\n2127 005\nCASHIER NAME: Florence\n120GR\n500ML\n32.99\nCASHIER/ DATE / TIME\n21.99\n12.23\n4.78\nL\nTHANK YOU FOR\nYOUR SUPPORT\nPLEASE CALL AGAIN\n35.99\n73.93\n209.66\n209.66\nincl.\n28.99\n77.03\n97.46\n31.20\n18.03.24\n16:12\n97.46",
    "place_name": "SUPERSPAR",
    "timestamp": "2024-03-18 16:12",
    "items": [
      {
        "name": "LAYS AMERICAN BBQ 120GR",
        "quantity": 1,
        "price": 23.99
      },
      {
        "name": "LIPTON ICE TEA 500ML",
        "quantity": 1,
        "price": 21.99
      },
      {
        "name": "M/MAINE ASSORTED PIZZA",
        "quantity": 1,
        "price": 32.99
      },
      {
        "name": "TUC BISC 100G",
        "quantity": 1,
        "price": 12.23
      },
      {
        "name": "SPAR GRN A T/CH",
        "quantity": 1,
        "price": 67.76
      },
      {
        "name": "MERBA COOKIES CHOCOLATE 200GR",
        "quantity": 1,
        "price": 35.99
      },
      {
        "name": "SPAR MIN WATER 5LT",
        "quantity": 1,
        "price": 28.99
      }
    ],
    "total": 209.66,
    "currency": "R"
  },{
    "ocr": "KIT KAT CHOC MILK 4F\nBREAD\nSAVOURY\n1\nMENLYN MAIN CENTRE\nSUPERSPAR\nVAT NR: 4770111336\nLIQ LIC: GLB700000378\nPHONE NR: 012 348 2204\nVAT rate\n15.00%\n@ 24.99\nTOTAL\nTENDERED Credit Card\nFOR 2 ITEMS\nSLIP / TILL\n7840 004\nCASHIER NAME:\nTAX INVOICE\nTAX\n5.21\nexcl.\n34.77\n41.5G\nEACH\n/ CASHIER / DATE\n212 26.03.24\nNtombi\nTHANK YOU FOR\nYOUR SUPPORT\nPLEASE CALL AGAIN\nR\n14.99 A\n24.99 A\n39.98\n39.98\nincl,\n39.98 A\n/ TIME\n12:07",
    "place_name": "SUPERSPAR",
    "timestamp": "2024-03-26 12:07",
    "items": [
      {
        "name": "KIT KAT CHOC MILK 4F 41.5G",
        "quantity": 1,
        "price": 14.99
      },
      {
        "name": "SAVOURY BREAD",
        "quantity": 1,
        "price": 24.99
      }
    ],
    "total": 39.98,
    "currency": "R"
  },
  {
    "ocr": "SAVOURY\n1\nVAT rate\n15.00%\nMENL YN MAIN CENTRE\nSUPERSPAR\nVAT NR: 47/0111336\nLIQ LIC: GLB700000378\nPHONE NR: 012 348 2204\nC.93\nTOTAL FOR 1 ITEMS\nTENDERED Credit Card\nSLIP /\n4772\nBREAT\nTAX INVOICE\nexcl.\n21.73\nEACH\n007\nCASHIER NAME: Fikile\nTAX\n3.26\n203\nR\nTHANK YOU FOR\nYOUR SUPPORT\nPLEASE CALL AGAIN\n24.99 A\n24.99\nTILL / CASHIER / DATE/ TIME\n15.03.24 12:09\n24.99\nincl.\n24.99 A",
    "place_name": "SUPERSPAR",
    "timestamp": "2024-03-15 12:09",
    "items": [
      {
        "name": "SAVOURY BREAD",
        "quantity": 1,
        "price": 24.99
      }
    ],
    "total": 24.99,
    "currency": "R"
  },
  {
    "ocr": "VAT rate\n15.00%\nSUPHRRAR\nSAVQURY BREAD\n1@ 24.99\nSIR THE BERRIES\n(K)SPAR CARRIERS BAG RE 1'S\nTOTAL FUR 3 ITEMS\nTENDERED Credit Card\nMENLYN MAIN CENTRE\nSUPERSPAR\nVAT NR: 4770111336\nLIQ LIC: GLB700000378\nPHONE NR: 012 348 2204\n6716\nexcl.\n46.50\nEACH\nTAX INVOICE\nTAX\n500ML\nCASHIER NAME: Violet\nSLIP / TILL / CASHIER / DATE /\n006 .225\n6.98\nR\nTHANK YOU FOR\nYOUR SUPPORT\nPLEASE CALL AGAIN\n24.99 A\n26.99 A\n1.50 A\n53.48\n53.48\nTIME\n15.04.24 12:19\ninc].\n53.48 A",
    "place_name": "SUPERSPAR",
    "timestamp": "2024-04-15 12:19",
    "items": [
      {
        "name": "SAVOURY BREAD",
        "quantity": 1,
        "price": 24.99
      },
      {
        "name": "SIR THE BERRIES 500ML",
        "quantity": 1,
        "price": 26.99
      },
      {
        "name": "SPAR CARRIERS BAG RE 1'S",
        "quantity": 1,
        "price": 1.50
      }
    ],
    "total": 53.48,
    "currency": "R"
  },
  {
    "ocr": "VAT rate\n15.00%\nMENLYN MAIN CENTRE\nSUPERSPAR\nVAT NR: 4770111336\nLIQ LIC: GLB700000378\nPHONE NR: 012 348 2204\nOREO BISC 128.8G\nDORITOS SNT CHIL\nMAYNARDS W/GUMS\nPRV FRZN CHICKEN GORDON 1P/KG\n0.310kg @\nAQUELLE WATER STILL\nTOTAL FOR 5 ITEMS\nTENDERED Credit Card\n6740\n128.8\n240GR\n400GR\n131,99 R kg\n5LT\nTAX INVOICE\nexcl. TAX\n162.50 24.38\n207\nSLIP / TILL / CASHIER / DATE /\n006\nCASHIER NAME: Kwena\nTHANK YOU FOR\nYOUR SUPPORT\nPLEASE CALL AGAIN\nR\n17.99 A\n25.99 A\n69.99 A\n40.92 A\n31.99 A\n186.88\n186.88\nincl.\n186.88 A\nTIME\n07.05.24 17:13",
    "place_name": "SUPERSPAR",
    "timestamp": "2024-05-07 17:13",
    "items": [
      {
        "name": "OREO BISC 128.8G",
        "quantity": 1,
        "price": 17.99
      },
      {
        "name": "DORITOS SNT CHIL 240GR",
        "quantity": 1,
        "price": 25.99
      },
      {
        "name": "MAYNARDS W/GUMS 400GR",
        "quantity": 1,
        "price": 69.99
      },
      {
        "name": "PRV FRZN CHICKEN GORDON 0.310kg",
        "quantity": 1,
        "price": 40.92
      },
      {
        "name": "AQUELLE WATER STILL 5LT",
        "quantity": 1,
        "price": 31.99
      }
    ],
    "total": 186.88,
    "currency": "R"
  },
  {
    "ocr": "MENLYN MAIN CENTRE\nSUPERSPAR\nVAT NR: 4770111336\nLIQ LIC: GLB700000378\nPHONE NR: 012 348 2204\nOREO ICE CREAM S\nWILLARDS FLAN SS\nLIPTON ICE TEA\nSPAR MILK SKIM\n0.722kg @\nSPAR GRNOLA T/CH\nTOTAL FOR 6 ITEMS\nTENDERED Credit Card\nVAT rate\n0.00%\n15.00%\n87.99 R\nFRESH CHICKEN FILLETS 7 /KG\nexcl.\n19.49\n90ML\n189.99\n120GR\nSLIP / TILL\n5779 007\nCASHIER NAME: 0detta\n1.5LT\n1LT\nTAX INVOICE\n/kg\n1KG\nTAX\n0.00\n28.50\nR\n28.99 A\nTHANK YOU FOR\nYOUR SUPPORT\nPLEASE CALL AGAIN\n25.99 A\n25.99 A\n19.49 *\n63.53 A\n73.99 A\n237.98\n237.98\nincl.\n19.49 *\n218.49 A\n/ CASHIER / DATE/ TIME\n209 12.05.24 12:29",
    "place_name": "SUPERSPAR",
    "timestamp": "2024-05-12 12:29",
    "items": [
      {
        "name": "OREO ICE CREAM S 90ML",
        "quantity": 1,
        "price": 19.49
      },
      {
        "name": "WILLARDS FLAN SS 120GR",
        "quantity": 1,
        "price": 25.99
      },
      {
        "name": "LIPTON ICE TEA 1.5LT",
        "quantity": 1,
        "price": 25.99
      },
      {
        "name": "SPAR MILK SKIM 1LT",
        "quantity": 1,
        "price": 28.99
      },
      {
        "name": "FRESH CHICKEN FILLETS 0.722kg",
        "quantity": 1,
        "price": 63.53
      },
      {
        "name": "SPAR GRNOLA T/CH 1KG",
        "quantity": 1,
        "price": 73.99
      }
    ],
    "total": 237.98,
    "currency": "R"
  },
  {
    "ocr": "PicknPlay\nCASHIER: URENDA MATSEBA\nMenl yn Maine\n087 750 2054 /2053\nMCCAIN BABY PEAS 500g\n# ZERO-RATED\nVAT INCL\ne NON-SUPPLY\nDUE VAT INCL\n--TENDER--\nMASTERCARD\n835336\nTOTAL ITEMS:\n--TAX INVOICE--\nTAXABLE VAL\n41.99\n0.00\n41.99#V\n41.99\n41.99\nVAT VAL\n1\n0.00\n--VAT REG NO. 4090105588\nV VITALITY HEAL THYF0OD CASH BACK ITEM\nWEBSITE: www.pi cknpay. co.za\nTHANK YOU FOR SHOPPING WITH US.\n0.00\nLi quor Lic. :GLB//5001126\nPLEASE RETAIN AS YOUR GUARANTEE\nCUSTOMER CARE LINE: 0860 30 30 30\nx849349 3867 50001016 2 14.05.24 17:11",
    "place_name": "PicknPay",
    "timestamp": "2024-05-14 17:11",
    "items": [
      {
        "name": "MCCAIN BABY PEAS 500g",
        "quantity": 1,
        "price": 41.99
      }
    ],
    "total": 41.99,
    "currency": "R"
  },
  {
    "ocr": "MENLYN MAIN CENTRE\nSUPERSPAR\nVAT rate\n0.00%\n15.00%\nVAT NR: 4770111336\nLIQ LIC: GLB700000378\nPHONE NR: 012 348 2204\nDORITOS SMT CHIL\nKOO SWT/CORN CRM\nNATURES MIX VEG\nPRV_FRZN CHICKEN GORDON\n0.308kg @\nSPAR MILK SKIM\nAQUELLE WATER STILL\nTOTAL FOR 6 ITEMS\nTENDERED Credit Card\n131.99 R\nexcl.\n72.48\nSLIP / TILL\n0035 006\nCASHIER NAME:\n100.54\n240GR\n215G\n1KG\n1P/KG\n/kg\n1LŤ\nTAX INVOICE\n5LT\nTAX\n0.00\n15.08\nR\nNtombi\nTHANK YOU FOR\nYOUR SUPPORT\nPLEASE CALL AGAIN\n25.99 A\n16.99 A\n52.99 *\n40.65 A\n19.49 *\n31.99 A\n188.10\n188.10\nincl.\n72.48 *\n115.62 A\n/ CASHIER / DATE /\n212 14.05.24 17:18\nTIME",
    "place_name": "SUPERSPAR",
    "timestamp": "2024-05-14 17:18",
    "items": [
      {
        "name": "DORITOS SMT CHIL 240GR",
        "quantity": 1,
        "price": 25.99
      },
      {
        "name": "KOO SWT/CORN CRM 215G",
        "quantity": 1,
        "price": 16.99
      },
      {
        "name": "NATURES MIX VEG 1KG",
        "quantity": 1,
        "price": 52.99
      },
      {
        "name": "PRV_FRZN CHICKEN GORDON 0.308kg",
        "quantity": 1,
        "price": 40.65
      },
      {
        "name": "SPAR MILK SKIM 1LT",
        "quantity": 1,
        "price": 19.49
      },
      {
        "name": "AQUELLE WATER STILL 5LT",
        "quantity": 1,
        "price": 31.99
      }
    ],
    "total": 188.10,
    "currency": "R"
  },
  {
    "ocr": "SAVOURY\nMENLYN MAIN CENTRE\nSUPERSPAR\nBREAD\n1 @ 24.99\nLIPTON I/TEA M/B\nTOTAL FOR 2 ITEMS\nTENDERED Credit Card\nVAT rate\n15.00%\nVAT NR: 4770111336\nLIO LIC: GLB700000378\nPHONE NR: 012 348 2204\nexc],\nTAX INVOICE\n37.37\nEACH\nSLIP / TILL\n6193 007\nCASHIER NAME: 0detta\n500ML\nTAX\n5.61\nR\nTHANK YOU FOR\nYOUR SUPPORT\nPLEASE CALL AGAIN\n24.99 A\n17.99 A\n42.98\n42.98\nincl.\n42.98 A\n/ CASHIER / DATE / TIME\n209 1",
    "place_name": "SUPERSPAR",
    "timestamp": "2024-01-09 12:09",
    "items": [
      {
        "name": "SAVOURY BREAD",
        "quantity": 1,
        "price": 24.99
      },
      {
        "name": "LIPTON I/TEA M/B 500ML",
        "quantity": 1,
        "price": 17.99
      }
    ],
    "total": 42.98,
    "currency": "R"
  },
  {
    "ocr": "PicknPay\ne\nMenl yn Maine\n087 750 2054 /2053\nCASHIER: Lucia Boishel o\nVAT INCL\nZERO-RATED\nNON-SUPPLY\nPNP SAVOURY ROLLS 4EA\nCHOC BAR 80GR\nDUE VAT INCL\n--TENDER--\nMASTERCARD\n850177\nTOTAL ITEMS:\n--TAX INVOICE-\nTAXABLE VAL\n52.98\n0.00\nLiquor Lic.:GLB//5001126\n29.99\nx477018 3867 1023323\n22.99\nWEBSITE: www.pi cknpäy.co.Zi\nTHANK YOU FOR SHOPPING WITH US.\n52.98\n52.98\nVAT VAL\n---VAT REG N0. 40901O5588\nV VITALITY HEALTHYFOOD CASH BACK 1TEM\n2\n6.91\n0.00\nPLEASE RETAIN AS YOUR GUARANTEE\nCUSTOMER CARE LINE: 0860 30 30 30\n08.05.24 12:16",
    "place_name": "PicknPay",
    "timestamp": "2024-05-08 12:16",
    "items": [
      {
        "name": "PNP SAVOURY ROLLS 4EA",
        "quantity": 1,
        "price": 29.99
      },
      {
        "name": "CHOC BAR 80GR",
        "quantity": 1,
        "price": 22.99
      }
    ],
    "total": 52.98,
    "currency": "R"
  },
  {
    "ocr": "Menlyn Maine Central Square, Corner of\nDallas Ave and, Aramist Ave, Menlyn,\nPretoria\nKAUAI MENLYN MAINE\nPhone: 087 159 0127\n4575 Bong inhlanhl\nCHK 1564\nCard Ret\nNATURALLY\nSubtotal\nPayment\nVAT:\n1 Berry Dairy Lrg\n+Whey Protein\n2024/05/08\nChange DUe\n11.61 RSA VAT 15%\n11.61 Tax\nTBL l01/1\n5:09 PM\n69.00\n20.00\nR89.00\nR89.00\nCheck Closed\n2024/05/08 17:09\nR89.00\nRO.00\n89.00\n89.00",
    "place_name": "KAUAI MENLYN MAINE",
    "timestamp": "2024-05-08 17:09",
    "items": [
      {
        "name": "Berry Dairy Lrg",
        "quantity": 1,
        "price": 69.00
      },
      {
        "name": "Whey Protein",
        "quantity": 1,
        "price": 20.00
      }
    ],
    "total": 89.00,
    "currency": "R"
  },
  {
    "ocr": "MENLYN MAIN CENTRE\nSUPERSPAR\nVAT NR: 4770111336\nLIQ LIC: GLB700000378\nPHONE NR: 012 348 2204\nSPAR SPAGHETTI\nULT/BLENDS SHAMP\nTOTAL FOR 2 ITEMS\nTENDERED Credit Card\nVAT rate\n15.00%\nexcl.\n101.72\n500GR\nTAX INVOICE\nTAX\n400ML\n15.26\n212\n[\nR\nTHANK YOU FOR\nYOUR SUPPORT\nPLEASE CALL AGAIN\n18.99 A\n97.99 A\n116.98\nSLIP / TILL / CASHIER/ DATE / TIME\n0559 006\n15.05.24\nCASHIER NAME: Ntombi\n116.98\nincl.\n116.98 A\n17:13",
    "place_name": "SUPERSPAR",
    "timestamp": "2024-05-15 17:13",
    "items": [
      {
        "name": "SPAR SPAGHETTI 500GR",
        "quantity": 1,
        "price": 18.99
      },
      {
        "name": "ULT/BLENDS SHAMP 400ML",
        "quantity": 1,
        "price": 97.99
      }
    ],
    "total": 116.98,
    "currency": "R"
  },
  {
    "ocr": "KAUAI MENLYN MAINE\nHenlyn Maine Central Square, Corner of\nDallas Ave and, Aram ist Ave, Menlyn,\nPretoria\nPhone : 087 159 0127\n4575 Bonginhlanhl\nSubtotal\nPayment\nVAT:\nNATURALLY\nCHK 1464 TBL 120/1\n2024/05/14 12:14 PM\n1 Roasted Veg Falafel Wrap\n1 Strawberry Stinger Lrg\nCard Ret\n20.74 Tax\nChange Due\n20.74 RSA VAT 15%\n95.00\n64.00\nR159.00\nRI59.00\nR159.00\nCheck Closed\n2024/05/14 12:14 PM\nRO.00\n159.00\n159.00",
    "place_name": "KAUAI MENLYN MAINE",
    "timestamp": "2024-05-14 12:14",
    "items": [
      {
        "name": "Roasted Veg Falafel Wrap",
        "quantity": 1,
        "price": 95.00
      },
      {
        "name": "Strawberry Stinger Lrg",
        "quantity": 1,
        "price": 64.00
      }
    ],
    "total": 159.00,
    "currency": "R"
  },
  {
    "ocr": "SPERSPAAO\nVAT rate\n15.00%\nMENLYN MAIN CENTRE\nSUPERSPAR\nVAT NR: 4770111336\nLIQ LIC: GLB700000378\nPHONE NR: 012 348 2204\nSAVOURY BREAD\n1@ 24.99\nSPAR P/CRISPS 17\nTOTAL FOR 2 ITEMS\nTENDERED Credit Card\n67.81\nEACH\n- TAX INVOICE\nexcl.\n170G\n4282 006\nCASHIER NAME: Fikile\nTAX\n10.17\nSLIP / TILL/ CASHIER/ DATE /\n203 02.05.24\n02.05.24\nTHANK YOU FOR\nYOUR SUPPORT.\nPLEASE CALL AGAIN\nR\n24.99 A\n52.99 A\n77.98\n77.98\nincl.\n77.98 A\nTIME\n12:06",
    "place_name": "SUPERSPAR",
    "timestamp": "2024-05-02 12:06",
    "items": [
      {
        "name": "SAVOURY BREAD",
        "quantity": 1,
        "price": 24.99
      },
      {
        "name": "SPAR P/CRISPS 170G",
        "quantity": 1,
        "price": 52.99
      }
    ],
    "total": 77.98,
    "currency": "R"
  },
  {
    "ocr": "Salsa Mexican Grill\nITEM\nMen1yn Maine\n117 bancor ave\nShop 654. Menlyn Maine Central\n0126820161\nPRO-FORMA INVOICE: 00175958\n4580241539\nTIME : 13/05/2024 18:25\nWAITER: brian (800)\nCorona\nHalf Mild Nach\nRekordel ig Pas\nTendered\nFEEL G00D FOOD\nQTY\n1\n1\n1\nBil1 Total\nPRICE\n46.00\n89.00\n55.00\nTax @ 15% (already included)\nTABLE: 464\nAND VISA ACCEPTED\nCOVERS:\n0.00\n1\nVALUE\n46.00\n89.00\n55.00\n190.00\nIF YOU WISH TO PAY BY CARD ONLY MASTER\n24,78",
    "place_name": "Salsa Mexican Grill",
    "timestamp": "2024-05-13 18:25",
    "items": [
      {
        "name": "Corona",
        "quantity": 1,
        "price": 46.00
      },
      {
        "name": "Half Mild Nach",
        "quantity": 1,
        "price": 89.00
      },
      {
        "name": "Rekordel ig Pas",
        "quantity": 1,
        "price": 55.00
      }
    ],
    "total": 190.00,
    "currency": "R"
  },
  {
    "ocr": "FRESH CHICKEN FILLETS 7 /KG\n0.606kg @ 87.99 R\nOREO ICE CREAM S\nSWITCH ENERGY CRAN CHER 500ML\nMENLYN MAIN CENTRE\nSUPERSPAR\nVAT NR: 4770111336\nLIQ LIC: GLB700000378\nPHONE NR: 012 348 2204\n3 @ 11.99\nTOTAL FOR 5 ITEMS\nTENDERED Credit Card\nVAT rate\n15.00%\n3022\n/kg\n9OML\n-- TAX INVOICE\nexcl.\n102.85 15.43\nTAX\nSLIP_/ TILL / CASHIER / DATE\n003 231 27.04.24\nCASHIER NAME: TSHIAMO\nTHANK YOU FOR\nYOUR SUPPORT\nPLEASE CALL AGAIN\nR\n53.32 A\n28.99 A\n35.97 A\n118.28\n118.28\nincl.\n118.28 A\n/ TIME\n16:16",
    "place_name": "SUPERSPAR",
    "timestamp": "2024-04-27 16:16",
    "items": [
      {
        "name": "FRESH CHICKEN FILLETS 0.606kg",
        "quantity": 1,
        "price": 53.32
      },
      {
        "name": "OREO ICE CREAM S 90ML",
        "quantity": 1,
        "price": 28.99
      },
      {
        "name": "SWITCH ENERGY CRAN CHER 500ML",
        "quantity": 3,
        "price": 11.99
      }
    ],
    "total": 118.28,
    "currency": "R"
  },
  {
    "ocr": "MENLYN MAIN CENTRE\nSUPERSPAR\nVAT NR: 4770111336\nLIQ LIC: GLB700000378\nPHONE NR: 012 348 2204\nSAVOURY BREAD\n1@ 24.99\nREESES PEANUT BUTTER CU 42G\nTOTAL FOR 2 ITEMS\nTENDERED Credit Card\nVAT rate\n15.00%\nSLIP / TILL\n4756\n001\nCASHIER NAME:\nTAX INVO0ICE\nexcl,\n44.33\nEACH\nTAX\n6.65\n207\nR\nKwena\nTHANK YOU FOR\nYOUR SUPPORT\nPLEASE CALL AGAIN\n24.99 #\n25.99\n50.98\n50.98\nincl.\n50.98\n/ CASHIER/ DATE / TIME\n25.04.24 12:23",
    "place_name": "SUPERSPAR",
    "timestamp": "2024-04-25 12:23",
    "items": [
      {
        "name": "SAVOURY BREAD",
        "quantity": 1,
        "price": 24.99
      },
      {
        "name": "REESES PEANUT BUTTER CU 42G",
        "quantity": 1,
        "price": 25.99
      }
    ],
    "total": 50.98,
    "currency": "R"
  },
  {
    "ocr": "MENLYN MALN CENTRE\nSUPERSPAR\nAuthorized by: 150\nVAT NR: 4770111336\nLIQ LIC: GLB700000378\nPHONE NR: 012 348 2204\nTsakane\nFRZ MIXED VEG\nF-UNPEELD ONIONS 1KG\nDIVELLA CUBETTATO\nSPAR SPAGHETTI\nBUTCHERY NON SCAN VAT\nTOTAL\nVAT rate\n0.00%\n15.00%\nTENDERED Credit Card\nFOR 5 1TEMS\n2064\nCASHIER\nexc1.\n59.98\nTAX INVICE\n65.55\n1KG\n1KG\n400G\n006\nNAME: Kwena\n5006R\nTAX\n0.00\n9.83\n207\nR\n37.99 *\n21.99 #*\n29.99 A\n18.99 A\nTHANK YOU FOR\nYOUR SUPPORT\nPLEASE CALL AGAIN\n26.40 A\n135.36\nToday SPAR Saved You\n11.00\n135.36\nSLIP / TILL / CASHIER / DATE/ TINE\nincl.\n59.98 *\n75.38 A\n06.03.24 17:32",
    "place_name": "SUPERSPAR",
    "timestamp": "2024-03-06 17:32",
    "items": [
      {
        "name": "FRZ MIXED VEG 1KG",
        "quantity": 1,
        "price": 37.99
      },
      {
        "name": "F-UNPEELD ONIONS 1KG",
        "quantity": 1,
        "price": 21.99
      },
      {
        "name": "DIVELLA CUBETTATO 400G",
        "quantity": 1,
        "price": 29.99
      },
      {
        "name": "SPAR SPAGHETTI 500GR",
        "quantity": 1,
        "price": 18.99
      },
      {
        "name": "BUTCHERY NON SCAN VAT",
        "quantity": 1,
        "price": 26.40
      }
    ],
    "total": 135.36,
    "currency": "R"
  },
  {
    "ocr": "MAGGI 2MIN NDL 5\nLAYS SALT\nVAT rate\n0.00%\n15.00%\nMENLYN MAIN CENTRE\nSUPERSPAR\nVAT NR: 4770111336\nLIQ LIC: GLB700000378\nPHONE NR: 012 348 2204\nF-GOLDEN DELIC ECONO\nSPAR MILK L/L 2%\nLIPTON ICE TEA\n(K) SPAR CARRIERS BAG RE 1'S\nTOTAL FOR 6 ITEMS\nTENDERED Credit Card\nToday\n1465\nexcl.\n55.98\n5EA\n120GR\n1.5KG\nTAX INV0ICE\n70.84\n1LT\n007\nCASHIER NAME: Fikile\n1.5LT\nTAX\n0.00\n10.63\nSPAR Saved\n7.00\nSLIP / TILL / CASHIER / DATE\nR\nTHANK YOU FOR\nYOUR SUPPORT\nPLEASE CALL AGAIN\n29.99 A\n23.99 A\n35.99 *\n19.99 *\n25.99 A\n1.50 A\n137.45\n137.45\nincl.\n55.98 *\n81.47 A\nYou\n/ TIME\n203 05.03.24 17:35",
    "place_name": "SUPERSPAR",
    "timestamp": "2024-03-05 17:35",
    "items": [
      {
        "name": "MAGGI 2MIN NDL 5EA",
        "quantity": 1,
        "price": 29.99
      },
      {
        "name": "LAYS SALT 120GR",
        "quantity": 1,
        "price": 23.99
      },
      {
        "name": "F-GOLDEN DELIC ECONO 1.5KG",
        "quantity": 1,
        "price": 35.99
      },
      {
        "name": "SPAR MILK L/L 2% 1LT",
        "quantity": 1,
        "price": 19.99
      },
      {
        "name": "LIPTON ICE TEA 1.5LT",
        "quantity": 1,
        "price": 25.99
      },
      {
        "name": "SPAR CARRIERS BAG RE 1'S",
        "quantity": 1,
        "price": 1.50
      }
    ],
    "total": 137.45,
    "currency": "R"
  },
  {
    "ocr": "VAT rate\n15.00%\nMENLYN MAIN CENTRE\nSUPERSPAR\nSISTEMA RECTANGULAP KLI 1L\nTOTAL FOR 1 ITEMS\nTENDERED Credit Card\nVAT NR: 4770111336\nLIQ LIC: GLB700000378\nPHONE NR: 012 348 2204\n1464\nTAX INVOICE\nexcl.\n104.77\nTAX\n15.72\nSLIP / TILL / CASHIER / DATE /\n002\nCASHIER NAME: Kearabi lwe\n202 08.03.24\nTHANK YOU FOR\nYOUR SUPPORT\nPLEASE CALL AGAI N\nR\n120.49\n120.49\n120.49\nincl\n120.49\nTIME\n16:18",
    "place_name": "SUPERSPAR",
    "timestamp": "2024-03-08 16:18",
    "items": [
      {
        "name": "SISTEMA RECTANGULAP KLI 1L",
        "quantity": 1,
        "price": 120.49
      }
    ],
    "total": 120.49,
    "currency": "R"
  },
  {
    "ocr": "MENLYN MAIN CENTRE\nSUPERSPAR\nVAT NR: 4770111336\nLIQ LIC: GLB700000378\nPHONE NR: 012 348 2204\nCEREBOS IOD FLSK\nLAMB SHOULDER CHOPS\n0.326kg @ 179.99 R\nBAKED BEANS\nVoided Item:\nTOTAL\nTENDERED Credit Card\nVAT rate\n15.00%\n*(K)SPAR CARRIERS BAG R 1'S\n*(K)SPAR CARRIERS BAG R 1'S\nSPAR MIN WATER\nFOR 4 ITEMS\n111.87\nSLIP / TILL\n2127 007\nCASHIER NAME:\n500G\nP/KG\n/kg\n410GR\n- TAX INVOICE\nexc1. TAX\nKwena\n5LT\n16.78\n/ CASHIER' DATE\n207\n07.03.\nTHANK YOU FOR\nYOUR SUPPORT\nPLEASE CALL AGAIN\nR\n23.99 A\n58.68 A\n16.99 A\n1.50 A\n-1.50 A\n28.99 A\n128.65\n128.65\nincl.\n128.65 A\nTIME\n17:16",
    "place_name": "SUPERSPAR",
    "timestamp": "2024-03-07 17:16",
    "items": [
      {
        "name": "CEREBOS IOD FLSK 500G",
        "quantity": 1,
        "price": 23.99
      },
      {
        "name": "LAMB SHOULDER CHOPS 0.326kg",
        "quantity": 1,
        "price": 58.68
      },
      {
        "name": "BAKED BEANS 410GR",
        "quantity": 1,
        "price": 16.99
      },
      {
        "name": "SPAR MIN WATER 5LT",
        "quantity": 1,
        "price": 28.99
      }
    ],
    "total": 128.65,
    "currency": "R"
  },
  {
    "ocr": "MENLYN MAIN CENTRE\nSUPERSPAR\nVAT NR: 4770111336\nLIQ LIC: GLB700000378\nPHONE NR: 012 348 2204\nTsakane\nAuthorized by: 150\nSPAR GRNOLA T/CH\nN/GARDEN COU S/E\nSPEKKO RICE PARBOILED\nMR SHEEN D/WASH\nH/TASTY THICK SOYA S\nSATISKIN SH/CREM\nPANTENE SHAMPOO\nI/PMAN SPICES CHICK\nSUPAMAMA F/BAG\nBUTCHERY NON SCAN VAT\nAQUELLE STILL\n(K)SPARCLERS BAG RE 1S\nTOTAL FOR 12 ITEMS\nTENDERED Credit Card\nVAT rate\n0.00%\n15.00%\nexcl.\n87.98\n467.44\n1KG\n700GR\n2KG\n750ML\n250ML\nSLIP /\n1337\n005\nCASHIER NAME: PATRICIA M\n400ML\n360ML\n200ML\nTAX INVOICE\n15'S\n5LT\nTAX\n0.00\n70.12\nTiLL / CASHIER / DATE /\n253 05.03.24\nTHANK YOU FOR\nYOUR SUPPORT\nPLEASE CALL AGAIN\nR\n73.99 A\n39.99 *\n47.99 *\n27.99 A\n57.99 A\n55.99 A\n109 99 A\n4.99 A\n54 99 A\n80.14 A\n29.99 A\n1.50 A\n625.54\n625.54\nincl.\n87.98 *\n537.56 A\nTIME\nl:58",
    "place_name": "SUPERSPAR",
    "timestamp": "2024-03-05 13:58",
    "items": [
      {
        "name": "SPAR GRNOLA T/CH 1KG",
        "quantity": 1,
        "price": 73.99
      },
      {
        "name": "N/GARDEN COU S/E 700GR",
        "quantity": 1,
        "price": 39.99
      },
      {
        "name": "SPEKKO RICE PARBOILED 2KG",
        "quantity": 1,
        "price": 47.99
      },
      {
        "name": "MR SHEEN D/WASH 750ML",
        "quantity": 1,
        "price": 27.99
      },
      {
        "name": "H/TASTY THICK SOYA S 250ML",
        "quantity": 1,
        "price": 57.99
      },
      {
        "name": "SATISKIN SH/CREM 400ML",
        "quantity": 1,
        "price": 55.99
      },
      {
        "name": "PANTENE SHAMPOO 360ML",
        "quantity": 1,
        "price": 109.99
      },
      {
        "name": "I/PMAN SPICES CHICK 200ML",
        "quantity": 1,
        "price": 4.99
      },
      {
        "name": "SUPAMAMA F/BAG",
        "quantity": 1,
        "price": 54.99
      },
      {
        "name": "BUTCHERY NON SCAN VAT",
        "quantity": 1,
        "price": 80.14
      },
      {
        "name": "AQUELLE STILL 5LT",
        "quantity": 1,
        "price": 29.99
      },
      {
        "name": "SPARCLERS BAG RE 1S",
        "quantity": 1,
        "price": 1.50
      }
    ],
    "total": 625.54,
    "currency": "R"
  },
  {
    "ocr": "MENLYN MAIN CENTRE\nSUPERSPAR\nVAT NR: 4770111336\nLIQ LIC: GLB700000378\nPHONE NR: 012 348 2204\nSAVOURY BREAD\n1@ 24.99\nVAT rate\n15.00%\nBOS ICE TEA PEAC\nTOTAL FOR 2 ITEMS\nTENDERED Credit Card\nexcl.\nTAX INVOICE\n38.24\nEACH\nSLIP/ TILL\n1650 003\nCASHIER NAME: 0detta\n300ML\nTAX\n5.74\n/ CASHIER / DATE\n209 07.03.24\nTHANK YOU FOR\nYOUR SUPPORT\nPLEASE CALL AGAIN\n/\nR\n24.99 A\n18.99 A\n43.98\n43.98\nincl.\n43.98 A\nTIME\n12:14",
    "place_name": "SUPERSPAR",
    "timestamp": "2024-03-07 12:14",
    "items": [
      {
        "name": "SAVOURY BREAD",
        "quantity": 1,
        "price": 24.99
      },
      {
        "name": "BOS ICE TEA PEAC 300ML",
        "quantity": 1,
        "price": 18.99
      }
    ],
    "total": 43.98,
    "currency": "R"
  },
  {
    "ocr": "SAVOURY BREAD\n1@ 24.99\nBOS I/TEA BERRY\nTOTAL FOR 2 ITEMS\nTENDERED Credit Card\nVAT rate\n15.00%\nMENL YN MAIN CENTRE\nSUPERSPAR\nVAT NR: 4770111336\nLIQ LIC: GLB700000378\nPHONE NR: 012 348 2204\n1931\nEACH\n500ML\n- TAX INVOICE\nexcl.\n40,85\nTAX\n6.13\nSLIP / TILL / CASHIER / DATE /\n006\nCASHIER NAME: Kwena\n207 06.03.24\nTHANK YOU FO\nYOUR SUPPORT\nPLEASE CALL AGAIN\nR\n24.99 A\n21.99 A\n46.98\n46.98\ninc].\n46.98 A\nTIME\n12 :42",
    "place_name": "SUPERSPAR",
    "timestamp": "2024-03-06 12:42",
    "items": [
      {
        "name": "SAVOURY BREAD",
        "quantity": 1,
        "price": 24.99
      },
      {
        "name": "BOS I/TEA BERRY 500ML",
        "quantity": 1,
        "price": 21.99
      }
    ],
    "total": 46.98,
    "currency": "R"
  },
  {
    "ocr": "PicknPay\nCASHIER: Cashier 07 NC67\nDURACELL POWER PLUS AA2\n5000394146921\nP/CUT BEEF STIR FRY\nVAT INCL\n# ZERO-RATED\ne\nMenl yn Maine\n087 750 2054 /2053\nNON-SUPPLY\nDUE VAT INCL\n-TENDER-\nMASTERCARO\n830636\nTOTAL ITEMS:\nTAX INVOICE--\nTAXABLE VAL\n92.29\n0.00\nLiguor Lic.:GB//5001126\nG4.99\nx144339 3857 3867007 6\n27.30\nWEBSITE: Www.picknpay. co. Za\nTHANK YOU FCR SHOPPING WITH US\n92.29\n92.29\nVAT VAL\n--VAT REG NO. 4090105588\nV VITALITY HEALTHYFOOO CASH BACK ITEM\n12.04\nPLEASE RETAIN AS YOUR GUARANTEE\nCUSTOMER CARE LINE: 0860 30 30 30\n2\n0.00\n09.03.24 13-3",
    "place_name": "PicknPay",
    "timestamp": "2024-03-09 13:03",
    "items": [
      {
        "name": "DURACELL POWER PLUS AA2",
        "quantity": 1,
        "price": 64.99
      },
      {
        "name": "P/CUT BEEF STIR FRY",
        "quantity": 1,
        "price": 27.30
      }
    ],
    "total": 92.29,
    "currency": "R"
  }
]